IK阿帕琦多功能男士手表全自动机械表儿陀飞轮男表时尚潮流腕表," 厂家正品直销 白壳银圈白面浅啡皮带 白壳银壳白面深啡皮带 白壳银圈黑面黑皮带 白壳玫瑰金圈黑面黑皮带 潮流时尚 真皮 圆型 复古,其他,精钢,大表盘 日历 ",男士饰品,2000,0,755,528.5,购物满100元立减2元 购物满300元立减10元 购物满1000元立减50元 购物满300元立减50元,4,0,4.68,4.64,4.66,4.66,0,0,0,0,0,0,0,0,0,0,0,0,0,0,0.7,1,0,1,0,0,0,0,1,0,>2种优惠,0.0675,1,0.189214759,"(0,1]"
IK阿帕琦蓝宝石全自动机械表防水情侣表一百米防水男士手表," 厂家正品直销 潮流时尚 精钢 圆型 其他,大表盘 日历 ",男士饰品,5000,0,725,507.5,购物满100元立减2元 购物满300元立减10元 购物满1000元立减50元 购物满300元立减50元,4,0,4.68,4.64,4.66,4.66,0,0,0,0,0,0,0,0,0,0,0,0,0,1,0.7,1,0,1,0,0,0,0,1,0,>2种优惠,0.0675,1,0.197044335,"(0,1]"
IK阿帕琦蓝宝石全自动机械表镂空精钢手表防水情侣手表,"厂家正品直销 潮流时尚 精钢 圆型 其他,间金,镂空,大表盘 24小时指示",男士饰品,5000,0,798,558.6,购物满100元立减2元 购物满300元立减10元 购物满1000元立减50元 购物满300元立减50元,4,0,4.68,4.58,4.61,4.59,0,0,0,0,0,0,0,0,0,0,0,0,0,1,0.7,1,0,1,0,0,0,0,1,0,>2种优惠,0.0675,1,0.179018976,"(0,1]"
IK阿帕琦流行男表时尚男士休闲手表圆形全自动机械表,"厂家正品直销 潮流时尚 钢 圆型 其他,镂空,大表盘 24小时指示",男士饰品,500,0,310,217,购物满100元立减2元 购物满300元立减10元 购物满1000元立减50元 购物满300元立减50元,4,0,4.68,4.64,4.66,4.66,0,0,0,0,0,0,0,0,0,0,0,0,0,0,0.7,1,0,1,0,0,0,0,1,0,>2种优惠,0.0675,1,0.460829493,"(0,1]"
IK阿帕琦男士商务手表日历腕表全自动机械男表精钢表壳钢带," 厂家正品直销 潮流时尚 钢 圆型 复古,其他,精钢,间金,大表盘 日历 ",男士饰品,2000,0,390,273,购物满100元立减2元 购物满300元立减10元 购物满1000元立减50元 购物满300元立减50元,4,0,4.68,4.64,4.66,4.66,0,0,0,0,0,0,0,0,0,0,0,0,0,0,0.7,1,0,1,0,0,0,0,1,0,>2种优惠,0.0675,1,0.366300366,"(0,1]"
IK阿帕琦全自动机械手表男士腕表休闲男表时尚镂空手表男," 厂家正品直销 银色 金色 潮流时尚 精钢 圆型 其他,镂空,大表盘 透视窗 ",男士饰品,1000,0,560,392,购物满100元立减2元 购物满300元立减10元 购物满1000元立减50元 购物满300元立减50元,4,1,4.68,4.64,4.66,4.66,0,0,0,0,0,0,0,0,0,0,0,0,0,0,0.7,1,0,1,0,0,0,0,1,0,>2种优惠,0.0675,1,0.255102041,"(0,1]"
IK阿帕琦全自动男士手表机械表防水男款镂空时尚商务男表,"厂家正品直销 潮流时尚 不锈钢 圆型 复古,其他,镂空,大表盘 24小时指示",男士饰品,5500,0,459,321.3,购物满100元立减2元 购物满300元立减10元 购物满1000元立减50元 购物满300元立减50元,4,0,4.68,4.64,4.66,4.66,0,0,0,0,0,0,0,0,0,0,0,0,0,0,0.7,1,0,1,0,0,0,0,1,0,>2种优惠,0.0675,1,0.311235605,"(0,1]"
IK阿帕琦陀飞轮手表男士机械表全自动镂空机械表商务防水," 厂家正品直销 白面银圈银钢带 黑面金圈间金钢带 黑面银圈银钢带 潮流时尚 精钢 圆型 其他,精钢,镂空,大表盘 日历 ",男士饰品,1500,0,795,556.5,购物满100元立减2元 购物满300元立减10元 购物满1000元立减50元 购物满300元立减50元,4,0,4.68,4.64,4.66,4.66,0,0,0,0,0,0,0,0,0,0,0,0,0,0,0.7,1,0,1,0,0,0,0,1,0,>2种优惠,0.0675,1,0.179694519,"(0,1]"
MASOOMAKE侧拉链拼色粗跟厚底马丁靴,"35 36 37 38 39 圆头 绑带（系带) 棕色,黑色 马丁靴 中跟（3-5CM） 人造革（PU） 复古,英伦 橡胶底 人造长毛绒 粗跟 拼接 纯色 短筒 人造革（PU） 秋冬 系带,绑带",女鞋,447,-20,310,186,购物满199元立减15元,1,479,4.85,4.84,4.84,4.85,36,0,0,0,0,1,0,1,0,0,0,0,0,0,0.6,1,0,1,0,0,0,0,1,0,不超过1种优惠,0.075376884,1,1.198795181,"(1,2]"
NIKE/耐克AIRMAX2016跑步鞋＃新品上市,"806772-004 806772-400 806772-500 806772-401 806772-800 36 36.5 37.5 38 38.5 39 尖头 蝴蝶结,无 806772-401,806772-004,806772-400,806772-500,806772-800 平跟（小于等于1CM） 运动,经典 牛筋底 棉 平跟（无跟） 网状,镂空 其他 网布 夏季 系带",女鞋,474,0,1529,849,购物满5元立减5元,1,31,4.69,4.67,4.66,4.67,0,0,0,1,0,0,0,0,0,0,0,0,0,0,0.555264879,1,0,1,0,0,0,0,1,0,不超过1种优惠,1,1,0.005889282,"(0,1]"
NIKE/耐克AIRMAXTAILWIND8跑步鞋,"805942-500 805942-400 805942-001 36 36.5 37.5 38 38.5 39 尖头 蝴蝶结 805942-400,805942-001,805942-500 平跟（小于等于1CM） 运动,经典 橡胶底 网纱 平跟（无跟） 网状 其他 网布 夏季 系带",女鞋,0,0,999,549,购物满5元立减5元,1,37,4.69,4.67,4.66,4.67,0,0,0,0,0,0,0,0,0,0,0,0,0,0,0.54954955,1,0,1,0,0,0,0,1,0,不超过1种优惠,1,1,0.009107468,"(0,1]"
NIKE/耐克LunarGlide7跑步鞋＃夏季＃,"747356-500 747356-400 36 36.5 37.5 38 38.5 39 尖头 蝴蝶结 747356-500,747356-400 平跟（小于等于1CM） 运动,经典 橡胶发泡 PU 平跟（无跟） 编织 其他 网布 夏季 系带",女鞋,0,0,1049,569,购物满5元立减5元,1,16,4.69,4.67,4.66,4.67,0,0,0,0,0,0,0,0,0,0,0,0,0,0,0.542421354,1,0,1,0,0,0,0,1,0,不超过1种优惠,1,1,0.008787346,"(0,1]"
onlyou情侣手表一对价时尚潮奥利妮石英表商务夜光钢链防水,"厂家正品直销 情侣黑盘一对 情侣白盘一对 潮流时尚 钢 圆型 其他,大表盘 24小时指示",男士饰品,1000,0,864,604.8,购物满100元立减2元 购物满300元立减10元 购物满1000元立减50元 购物满300元立减50元,4,0,4.68,4.64,4.66,4.66,0,0,0,0,0,0,0,0,0,0,0,0,0,1,0.7,1,0,1,0,0,0,0,1,0,>2种优惠,0.0675,1,0.165343915,"(0,1]"
RISING真皮男士牛皮平滑扣皮带,"105cm（2尺5或以下） 110cm（2尺6-2尺7） 115cm（2尺8-2尺9） 120cm（3尺-3尺1） 125cm（3尺2-3尺3） 偏瘦体形（二尺二或以下） 银扣 黑色带身 黑扣 黑色带身 银扣 棕色带身 黑扣 棕色带身 基本款,商务 合金头 字母,光身 单圈 3-4cm 平滑扣 字母,光身 牛皮",男士饰品,7475,-20,70,49,NO INF,0,12,4.75,4.73,4.74,4.74,14,0,0,0,0,0,0,0,0,0,0,0,0,0,0.7,0,0,0,0,0,0,0,0,0,不超过1种优惠,0,0,0,0
Soneed韩版2016秋装新款女装纯色针织喇叭袖时尚套装,"SML 常规袖 韩系,通勤（OL） 混纺 普通 巧克力色 常规款（51-65cm） 半高领 七分袖 纯色 秋季",女装,9,-10.6,288,248.6,11.11红包最高再抵           20.00元,2,367,4.77,4.75,4.77,4.79,0,0,0,1,1,0,0,0,0,0,0,1,0,0,0.863194444,1,1,0,0,0,0,1,0,0,2种优惠,0,0,0,0
Soneed韩版2016秋装新款女装格子V领两件套时尚套装,"SML 常规袖 通勤（OL）,韩系 混纺 普通 灰色 常规款（51-65cm） V领 无袖 格子 春秋",女装,15,-14.7,398,273.7,11.11红包最高再抵           20.00元,2,66,4.77,4.75,4.77,4.79,0,0,0,1,1,0,0,0,0,0,0,1,0,0,0.687688442,1,1,0,0,0,0,1,0,0,2种优惠,0,0,0,0
Soneed韩版2016秋装新款女装格子七分袖阔腿连体裤," SML 韩系,通勤（OL） 其他 常规 深灰 口袋 格子 秋季",女装,9,-0.16,298,268.16,11.11红包最高再抵           20.00元,2,53,4.77,4.75,4.77,4.79,0,0,0,1,1,0,0,0,0,0,0,1,0,0,0.899865772,1,1,0,0,0,0,1,0,0,2种优惠,0,0,0,0
Soneed韩版2016秋装新款女装通勤纯色高腰九分背带裤," SML 韩系,通勤（OL） 腈纶 薄款 黑色,酒红色 口袋 纯色 春秋",女装,12,-16.2,358,245.2,11.11红包最高再抵           20.00元,2,22,4.77,4.75,4.77,4.79,0,0,0,1,1,0,0,0,0,0,0,1,0,0,0.684916201,1,1,0,0,0,0,1,0,0,2种优惠,0,0,0,0
SW5050新款欧美过膝靴系带高跟粗跟弹力骑士靴长靴羊皮,"黑色 酒红色 34 35 36 37 38 39 尖头 蝴蝶结,绑带（系带) 酒红色,黑色 长筒靴（中筒靴） 高跟（5-8CM） 头层牛皮 欧美 牛筋底 人造短毛绒 粗跟 反绒,磨砂 纯色 过膝 羊皮 秋冬 套脚,松紧带",女鞋,1177,0,369,258,购物满168元立减2元,1,226,4.76,4.72,4.72,4.75,24,0,0,1,0,0,1,1,0,0,0,0,0,0,0.699186992,1,0,1,0,0,0,0,1,0,不超过1种优惠,0.011904762,0,0.651162791,"(0,1]"
TERREAU黛璐翻领双排扣腰带麂皮姜黄女装风衣长款大衣外套,"SML 插肩袖 街头（潮人）,复古 其他 普通 直身 姜黄 长款（81-100cm） 双排扣 V领 长袖 腰带,落肩,系带,绒面,糖果色,镶边 纯色 秋冬",女装,47,0,396.8,297.6,11.11红包最高再抵           30.00元,2,343,4.75,4.75,4.75,4.78,15,0,0,0,0,0,0,1,0,0,0,0,0,0,0.75,1,1,0,0,0,0,1,0,0,2种优惠,0,0,0,0
TVG正品手表双显多功能男表精钢防水夜光石英表男士手表," 厂家正品直销 潮流时尚 不锈钢 圆型 大表盘,LED 闹铃 ",男士饰品,1000,0,772,540.4,购物满100元立减2元 购物满300元立减10元 购物满1000元立减50元 购物满300元立减50元,4,0,4.68,4.64,4.66,4.66,0,0,0,0,0,0,0,0,0,0,0,0,0,0,0.7,1,0,1,0,0,0,0,1,0,>2种优惠,0.0675,1,0.185048113,"(0,1]"
TVG正品智能手表男多功能时尚潮流计步手环夜光男女电子表,"厂家正品直销 潮流时尚 硅胶 长方型 其他,LED 24小时指示",男士饰品,2000,0,1198,838.6,购物满100元立减2元 购物满300元立减10元 购物满1000元立减50元 购物满300元立减50元,4,0,4.68,4.64,4.66,4.66,0,0,0,0,0,0,0,0,0,0,0,0,0,1,0.7,1,0,1,0,0,0,0,1,0,>2种优惠,0.0675,1,0.119246363,"(0,1]"
WUSSA多功能时尚手表,均码 黑色 蓝色 红色 褐 不锈钢 圆形 24小时指示 不锈钢,男士饰品,399,0,1620,567,NO INF,0,0,4.46,4.4,4.4,4.43,0,0,0,0,0,0,0,0,0,0,1,0,0,0,0.35,0,0,0,0,0,0,0,0,0,不超过1种优惠,0,0,0,0
ZARA环形拉片真皮德比鞋,"黑色 41 (265/89) 40 (260/88) 39 (255/87) 38 (250/86) 37 (240/85) 36 (235/84) 35 (225/83) 无 黑色 平跟（小于等于1cm） 街头潮人,欧美 橡胶底 棉 光板（无工艺效果） 纯色 头层牛皮 秋季 拉链",女鞋,30,0,699,698.9,购物满399元立减30元,1,54,4.73,4.64,4.71,4.78,0,0,0,0,0,0,1,0,0,0,0,0,0,0,0.999856938,1,0,1,0,0,0,0,1,0,不超过1种优惠,0.07518797,1,0.570897124,"(0,1]"
ZARA甲基丙烯酸酯鞋跟真皮短靴,"36 (235/84) 35 (225/83) 41 (265/89) 40 (260/88) 39 (255/87) 38 (250/86) 37 (240/85) 无 黑色 中跟（3-5CM） 街头潮人,欧美 塑料底 PU 光板（无工艺效果） 纯色 短筒 头层牛皮 秋季 拉链",女鞋,30,0,899,898.9,购物满399元立减30元,1,10,4.73,4.64,4.71,4.78,0,0,0,0,0,0,1,0,0,0,0,0,0,0,0.999888765,1,0,1,0,0,0,0,1,0,不超过1种优惠,0.07518797,1,0.443875848,"(0,1]"
ZARA金属鞋跟真皮短靴,"40 (260/88) 41 (265/89) 39 (255/87) 38 (245/86) 37 (240/85) 36 (235/84) 35 (230/83) 尖头 切尔西靴 黑色 短靴 中跟（3-5CM） 头层牛皮 街头潮人,欧美 橡胶底 牛皮 粗跟 无工艺效果 纯色 短筒 头层牛皮 秋冬 套脚",女鞋,35,0,699,698.9,购物满399元立减30元,1,2,4.73,4.64,4.71,4.78,0,0,0,0,0,0,1,1,0,0,0,0,0,0,0.999856938,1,0,1,0,0,0,0,1,0,不超过1种优惠,0.07518797,1,0.570897124,"(0,1]"
ZARA拉链真皮短靴,37 (240/85) 35 (225/83) 36 (235/84) 38 (250/86) 39 (255/87) 40 (260/88) 41 (265/89) 尖头 拉链 黑色 短靴 中跟（3-5cm） 头层牛皮 轻熟 橡胶底 布 方跟 无工艺效果 纯色 短筒 头层牛皮 春秋 拉链,女鞋,35,0,699,698.9,购物满399元立减30元,1,214,4.73,4.64,4.71,4.78,1,0,0,0,0,0,0,0,0,0,0,0,0,0,0.999856938,1,0,1,0,0,0,0,1,0,不超过1种优惠,0.07518797,1,0.570897124,"(0,1]"
zara女装秋冬皮毛一体机车夹克外套女02969269800,XSSM 常规袖 欧美 复合 加厚 宽松 黑色 中长款（66-80cm） POLO领 长袖 冬季,女装,135,0,578,289,NO INF,0,7,4.75,4.74,4.73,4.78,1,0,0,0,0,0,1,1,0,0,0,1,0,0,0.5,0,0,0,0,0,0,0,0,0,不超过1种优惠,0,0,0,0
Z扣男士休闲牛皮经典皮带,"100 105 110 115 120 125 黑色银扣 咖色银扣 咖色金扣 黑色金扣 橘色银扣 白色银扣 白色金扣 橘色金扣 棕色银扣 棕色金扣 深蓝银扣 深蓝金扣 休闲运动风,OL,职业,时代青年,韩国款,休闲中性 腰带 牛皮,二层牛皮 字母,光身,车缝线 单圈 普通款(2-4cm) 平滑扣 光面 字母,光身,车缝线 牛皮 牛皮,二层牛皮",男士饰品,2532,0,76,38,购物满99元立减5元,1,5,4.59,4.59,4.55,4.62,2,0,0,0,1,0,0,0,0,0,0,1,0,0,0.5,1,0,1,0,0,0,0,1,0,不超过1种优惠,0.050505051,1,2.605263158,"(2,8]"
凹凸秋冬女鞋明星款松糕鞋单鞋女厚底休闲系带五角星坡跟,"34 35 36 37 38 39 40 无 红色,杏色,全黑,黑色,蓝色 其他 高跟（5-8CM） 甜美,学院 橡胶底 PU 光板（无工艺效果） 其他 二层牛皮 秋冬 系带",女鞋,8745,-0.01,197.14,138,购物满300元立减20元,1,975,4.8,4.78,4.78,4.8,48,0,0,0,0,0,0,1,0,1,0,0,1,0,0.700010145,1,0,1,0,0,0,0,1,0,不超过1种优惠,0.066666667,1,2.174070585,"(2,8]"
奥迪斯运动手表潮流时尚男表防水学生电子表精钢商务休闲腕表正品,"厂家正品直销 全黑色 户外运动 橡胶 圆型 其他,大表盘 24小时指示",男士饰品,500,0,867,606.9,购物满100元立减2元 购物满300元立减10元 购物满1000元立减50元 购物满300元立减50元,4,0,4.68,4.64,4.66,4.66,0,0,0,0,0,0,0,0,0,0,0,0,0,0,0.7,1,0,1,0,0,0,0,1,0,>2种优惠,0.0675,1,0.164771791,"(0,1]"
白鸭绒连帽纯色修身中长款韩版男士羽绒服," M L XL XXL XXXL 常规袖 口袋,插袋 韩系,男友风 其它材质 修身 长款 连帽 纯色 黑色",男装,500,0,742,519.4,购物满150元立减5元 购物满200元立减8元 购物满300元立减15元 购物满100元立减2元 购物满168元立减5元 购物满268元立减8元,6,0,4.62,4.61,4.67,4.63,0,0,0,0,1,0,0,0,0,0,0,0,0,0,0.7,1,0,1,0,0,0,0,1,0,>2种优惠,0.033824331,0,0.192529842,"(0,1]"
薄款男士皮带男表方形男款手表休闲时尚潮商务男式防水腕表,均码 L-601玫瑰金白面棕皮 L-601银壳白面黑皮 L-601银壳黑面黑皮 L-601玫瑰金白面黑皮 L-601银壳白面棕皮 户外运动 皮革 其他 间金 日历,男士饰品,996,-8.75,255,176.75,购物满99元立减2元 购物满199元立减6元 购物满299元立减10元,3,5,4.59,4.61,4.59,4.62,1,0,0,0,0,0,0,0,0,0,1,0,0,0,0.693137255,1,0,1,0,0,0,0,1,0,>2种优惠,0.02793253,0,0.589285714,"(0,1]"
超薄品质手表男学生防水男表时尚潮流商务石英表男士皮带腕," 厂家正品直销 棕带白面玫金 棕带黑面玫金 黑带白面银圈 黑带黑面银圈 潮流时尚 皮革 圆型 复古,其他,大表盘 日历 ",男士饰品,1999,-5.2,276,193.2,购物满100元立减2元 购物满300元立减10元 购物满1000元立减50元 购物满300元立减50元,4,2,4.67,4.58,4.6,4.59,0,0,0,0,0,0,0,0,0,0,0,0,0,0,0.7,1,0,1,0,0,0,0,1,0,>2种优惠,0.0675,1,0.531914894,"(0,1]"
潮流时尚男表钨钢手表男, 均码 钨钢全黑色男款 钨钢本色男款 钨钢间金男款 钨钢咖啡金男款 钨钢全黑色女款 钨钢本色女款 钨钢间金女款 钨钢咖啡金女款 钨钢 圆形 日历 钨钢,男士饰品,766,0,365,270.55,NO INF,0,13,4.64,4.61,4.61,4.62,1,0,0,0,0,0,0,0,0,0,1,0,0,0,0.741232877,0,0,0,0,0,0,0,0,0,不超过1种优惠,0,0,0,0
春秋冬男士长袖t恤薄款纯棉修身翻领POLO衫潮流体恤休闲上衣,M L XL 2XL 3XL 白色 绿色 宝蓝色,男装,14998,0,105,73.5,NO INF,0,0,4.63,4.64,4.62,4.57,0,0,0,0,0,0,0,1,0,0,0,1,0,0,0.7,0,0,0,0,0,0,0,0,0,不超过1种优惠,0,0,0,0
春秋男装小衫新款印花男士长袖T恤打底衫大码体恤韩版青年潮流行,"M L XL 2XL 3XL 常规袖 撞色 日韩,学院 棉 修身 常规款 立领 色块,其他 长袖 白色 绿色 宝蓝色",男装,14997,-0.4,105,73.4,购物满138元立减5元 购物满208元立减10元 购物满499元立减30元,3,2,4.63,4.65,4.63,4.57,2,0,0,1,1,0,0,0,0,0,0,0,1,0,0.699047619,1,0,1,0,0,0,0,1,0,>2种优惠,0.048143016,0,1.890410959,"(1,2]"
搭配神器韩版牛皮圆头粗跟长靴中跟褶皱靴子弹力靴过膝靴女鞋子,"黑色 34 35 36 37 38 39 圆头 厚底内增高 黑色 长筒靴（中筒靴） 中跟（3-5CM） 弹力布 街头潮人,韩系 橡胶底 超纤 粗跟 水染 纯色 过膝 头层牛皮 秋季 套脚",女鞋,156,-7.875,893.34,266.875,购物满699元立减60元,1,397,4.82,4.8,4.82,4.82,5,0,0,0,1,0,0,0,0,0,0,0,0,0,0.298738442,1,0,1,0,0,0,0,1,0,不超过1种优惠,0.08583691,1,2.698841699,"(2,8]"
搭配神器韩版圆头厚底牛皮长靴弹力靴过膝靴拼色靴子冬季女鞋,"黑色（长筒） 黑色（短筒） 34 35 36 37 38 39 短筒筒高（31CM） 长筒筒高（54CM） 圆头 厚底内增高 黑色（长筒）,黑色（短筒） 长筒靴（中筒靴） 中跟（3-5CM） 头层牛皮 学院,欧美 橡胶底 人造短毛绒 厚底(松糕) 水染 纯色 短筒 头层牛皮 冬季 套脚",女鞋,439,-5.25,893.34,267.25,购物满699元立减60元,1,421,4.82,4.8,4.82,4.82,8,0,0,0,1,0,1,1,0,0,0,0,1,0,0.299158215,1,0,1,0,0,0,0,1,0,不超过1种优惠,0.08583691,1,2.667938931,"(2,8]"
大码个性拉链Z中长款男士休闲毛呢外套百搭修身呢子大衣冬款呢料,"S M L XL 2XL 3XL 4XL 5XL 贴袋,其它,口袋 日韩,欧美 毛呢 直身 长款 西装领 其他,纯色",男装,2394,-10.6,328,229.6,购物满119元立减5元 购物满199元立减10元 购物满299元立减20元,3,16,4.79,4.78,4.78,4.8,0,0,0,0,0,0,1,0,0,0,0,0,0,0,0.7,1,0,1,0,0,0,0,1,0,>2种优惠,0.053052565,1,0.543378995,"(0,1]"
大码女装秋装200斤胖mm宽松假两件胖妹妹牛仔连衣裙,"XLXXL3XL4XL 韩系,街头（潮人） 牛仔布 蓝色,黑色 套头 POLO领 长袖 纯色 纯色 秋冬",女装,1555,-3.5,165,115.5,11.11红包最高再抵           15.00元,2,128,4.79,4.77,4.78,4.8,20,0,0,0,1,0,0,1,0,0,0,1,0,0,0.7,1,1,0,0,0,0,1,0,0,2种优惠,0,0,0,0
大牌街头风格拉链朋克真皮牛皮中筒长靴子英伦马丁靴机车靴军靴潮,"黑色 34 35 36 37 38 39 圆头 拉链,金属装饰 黑色 长筒靴（中筒靴） 中跟（3-5CM） 反毛皮 欧美 橡胶底 超纤 方跟 无工艺效果 纯色 长筒 头层牛皮 秋冬 拉链,套脚",女鞋,653,-0.833333333,460,229.8333333,NO INF,0,478,4.82,4.82,4.82,4.85,6,0,0,0,0,1,1,1,0,0,0,0,0,0,0.499637681,0,0,0,0,0,0,0,0,0,不超过1种优惠,0,0,0,0
定制级复古羊皮方头粗跟长靴高跟系带长筒靴冬季及膝靴女鞋靴子,"棕色 34 35 36 37 38 39 方头 机车靴 棕色 短靴 高跟（5-8CM） 羊皮 街头潮人,复古 橡胶底 人造短毛绒 粗跟 磨砂 纯色 短筒 羊皮 冬季 系带",女鞋,167,-8.52,993.34,296.58,购物满699元立减60元,1,164,4.82,4.8,4.82,4.82,11,0,0,0,0,0,0,1,0,0,0,0,0,0,0.298568466,1,0,1,0,0,0,0,1,0,不超过1种优惠,0.08583691,1,2.426577796,"(2,8]"
东大门2016冬装连帽大毛领外套白鸭绒女士新款羽绒服韩版, 欧美 ,女士配饰,0,0,689.5,689.5,NO INF,0,0,4.52,4.49,4.5,4.48,0,0,0,1,1,0,1,1,0,0,0,0,0,0,1,0,0,0,0,0,0,0,0,0,不超过1种优惠,0,0,0,0
冬季男士长袖打底衫青年韩版修身加绒T恤衫学生潮冬装小衫上衣服,"M L XL 2XL 3XL 常规袖 加绒,拼接 日韩,学院 化纤 修身 常规款 圆领 几何,字母／文字／数字 长袖",男装,1991,-0.5,85,59.5,购物满100元立减8元 购物满200元立减10元 购物满299元立减20元,3,6,4.59,4.59,4.55,4.56,7,0,0,0,1,0,0,1,0,0,0,0,1,0,0.7,1,0,1,0,0,0,0,1,0,>2种优惠,0.065629877,1,1.694915254,"(1,2]"
冬季男装翻领中长款毛呢大衣韩版修身拼色单排扣呢子料外套潮大衣,"M L XL 2XL 3XL 撞色 日韩,街头 毛呢 收腰 中长款 双层领 拼色 灰色 藏青色",男装,1997,-8,340,238,购物满300元立减15元 购物满3件打9.50折 购物满100元立减5元 购物满200元立减10元,4,9,4.65,4.59,4.62,4.67,2,0,0,0,1,0,0,1,0,0,0,0,0,0,0.7,1,0,1,1,0,0,0,1,1,>2种优惠,0.05,1,0.434782609,"(0,1]"
冬季欧美风靴子复古磨砂皮粗跟高跟鞋过膝靴长靴尖头长筒靴单靴女,"34 35 36 37 38 39 尖头 英伦风,布洛克 卡其色,黑色 长筒靴（中筒靴） 高跟（5-8CM） 反毛皮 复古,欧美 橡胶底 人造短毛绒 粗跟 磨砂 纯色 过膝 头层牛皮 秋冬 拉链,绑带",女鞋,2300,0,547.5,208,购物满3元立减3元,1,1592,4.77,4.76,4.75,4.77,23,0,0,0,0,1,1,1,0,0,0,0,0,0,0.379908676,1,0,1,0,0,0,0,1,0,不超过1种优惠,1,1,0.014423077,"(0,1]"
冬季新款保暖修身大码羽绒服男士连帽羽绒衣加厚拉链纯色商务外套,"M L XL 2XL 3XL 4XL 5XL 常规袖 夹棉,口袋 日韩,商务 其它材质 修身 常规款 连帽 纯色 黑色 深蓝色",男装,2799,-0.342857143,512,358.3428571,NO INF,0,6,4.64,4.62,4.63,4.66,1,0,0,1,0,0,0,1,0,0,0,0,0,0,0.699888393,0,0,0,0,0,0,0,0,0,不超过1种优惠,0,0,0,0
冬季新款不规则压线棉衣男士修身棉袄外套青年加厚棉服潮牌,"M L XL 2XL 常规袖 绗缝,口袋 复古,民族 棉 宽松 常规款 立领 纯色 长袖 黑色",男装,397,-39.9,397,277.9,购物满99元立减5元 购物满198元立减10元 购物满298元立减15元 购物满498元立减30元,4,3,4.84,4.79,4.83,4.84,1,0,0,1,0,0,0,1,0,0,0,0,0,0,0.7,1,0,1,0,0,0,0,1,0,>2种优惠,0.052896659,1,0.415966387,"(0,1]"
冬季新款复古舒适毛线男女情侣韩范休闲男士学生保暖围脖围巾,"均码 酒红色 蓝色 休闲中性,小清新,中国风,韩系 冬季 围巾/丝巾 毛线 长方形 保暖 纯色 30cm-70cm 175cm-230cm 175cm-230cm 毛线",男士饰品,387,-4.166666667,230,68.16666667,购物满100元立减5元 购物满368元立减20元,2,46,4.63,4.59,4.61,4.62,5,0,0,1,1,0,0,1,0,0,1,0,0,1,0.296376812,1,0,1,0,0,0,0,1,0,2种优惠,0.052173913,1,1.5625,"(1,2]"
冬季新款复古舒适毛线男女情侣款韩范男士学生保暖针织围巾围脖,"均码 深灰色 蓝色 米色 小清新,韩系 冬季 围脖 毛线 其它形状 保暖 其他图案 30cm-70cm 50CM-90CM 50CM-90CM 毛线",男士饰品,595,-2.5,230,68.5,购物满100元立减5元 购物满368元立减20元,2,33,4.63,4.59,4.61,4.62,0,0,0,1,1,0,0,1,0,0,1,0,0,1,0.297826087,1,0,1,0,0,0,0,1,0,2种优惠,0.052173913,1,1.515151515,"(1,2]"
冬季新款男士潮人舒适亲肤品质羊绒礼盒包装男朋友礼物保暖围巾,"均码 灰色 蓝色 学院风,复古街头,职业,英伦风,文艺风,韩国风 冬季 围巾/丝巾 仿山羊绒 长方形 保暖 纯色 70cm-100cm 175cm-230cm 175cm-230cm 仿山羊绒",男士饰品,192,-1.714285714,111.43,77.71428571,NO INF,0,13,4.59,4.56,4.57,4.6,7,0,0,1,1,1,0,1,1,0,1,0,1,0,0.697426956,0,0,0,0,0,0,0,0,0,不超过1种优惠,0,0,0,0
冬季新款男士中长款连帽纯色韩版休闲棉衣棉服修身大码外套羽绒服,3XL 2XL XL L M 4XL 5XL 常规袖 水洗 运动 棉 修身 长款 连帽 纯色 黑色,男装,1397,0,513,359.1,购物满2件立减20元 购物满150元立减5元 购物满3件立减35元 购物满4件立减60元,4,42,4.64,4.58,4.6,4.65,7,0,0,1,1,0,0,1,0,0,0,0,0,0,0.7,1,0,1,0,0,0,0,1,0,>2种优惠,0.033333333,0,0.417710944,"(0,1]"
冬季新款舒适毛线男女情侣款韩范男士学生保暖围脖围巾,"均码 红蓝色 米咖色 黑灰色 小清新,韩系 春秋 围巾/丝巾 毛线 长方形 保暖 纯色 30cm-70cm 150cm-175cm 150cm-175cm 毛线",男士饰品,592,-2.571428571,230,68.57142857,购物满100元立减5元 购物满368元立减20元,2,26,4.63,4.59,4.61,4.62,6,0,0,1,1,0,0,1,0,0,1,0,0,1,0.298136646,1,0,1,0,0,0,0,1,0,2种优惠,0.052173913,1,1.515151515,"(1,2]"
冬季新品韩版女装墨绿色街头复古宽松长款加厚过膝直筒毛衣外套,"SML 常规袖 复古,韩系 其他 直身 墨绿 长款（81-100cm） 暗扣 西装领 长袖 纯色 纯色 冬季",女装,1500,-26.01,407.15,285.01,11.11红包最高再抵           30.00元,2,0,4.81,4.81,4.8,4.82,0,0,0,0,1,0,0,1,0,0,0,0,0,0,0.70001228,1,1,0,0,0,0,1,0,0,2种优惠,0,0,0,0
冬季真皮羊毛内增高短筒雪地靴女皮毛一体防滑保暖厚底短靴,"黑色（牛翻皮） 棕色（牛翻皮） 34 35 36 37 38 39 绑带（系带),厚底内增高,流苏 棕色,黑色 中跟（3-5cm） 韩系 橡胶底 羊毛羊绒混纺 反绒 纯色 二层牛皮 秋冬 套脚,系带",女鞋,1195,-2.625,720,287.625,NO INF,0,163,4.72,4.69,4.7,4.71,6,0,0,0,1,0,0,1,0,0,0,0,0,0,0.399479167,0,0,0,0,0,0,0,0,0,不超过1种优惠,0,0,0,0
冬季中长款羽绒服实拍大真毛领纯色百搭连帽羽绒衣女装外套,"SMLXLXXL 基本款,通勤（OL） 聚酯纤维 加厚 浅灰,白色,黑色 中长款（66-80cm） 暗扣 连帽 长袖 纯色 秋冬",女装,1500,-32.4,648,486,11.11红包最高再抵           50.00元,2,3,4.78,4.78,4.79,4.8,4,0,0,0,0,0,0,1,0,0,0,1,0,0,0.75,1,1,0,0,0,0,1,0,0,2种优惠,0,0,0,0
冬款连帽插肩拼接棉衣男士潮流立体贴口袋保暖外套男青年宽松棉服,"M L XL 2XL 常规袖 其它 日韩,运动 棉,锦棉（有光泽） 宽松 常规款 连帽 其他,几何 长袖 黑色",男装,1997,-30.1,383,268.1,购物满99元立减5元 购物满198元立减10元 购物满298元立减15元 购物满498元立减30元 活动商品买3件免1件,5,13,4.83,4.77,4.82,4.83,9,0,0,0,0,0,0,0,0,0,0,0,0,0,0.7,1,0,1,0,1,0,0,1,1,>2种优惠,0.052896659,1,0.415966387,"(0,1]"
冬装短裤百搭宽松呢子休闲靴裤打底裤阔腿短裤裤子胖mm大码女装,"L 建议100-125斤1XL 建议128-148斤2XL 建议150-170斤3XL 建议172-195斤M建议80-100斤 基本款,其他 棉 花色,紫红,黑色 其他,纯色,镶钻,刺绣,流苏 花色,手绘 秋冬",女装,8839,-3.99625,98.57,68.99625,11.11红包最高再抵           8.00元,2,610,4.81,4.8,4.8,4.8,99,0,0,0,0,0,0,1,0,0,0,0,0,0,0.699972101,1,1,0,0,0,0,1,0,0,2种优惠,0,0,0,0
冬装新款/韩版宽松字母长款羽绒服棉服大棉袄胖MM大码女装棉衣,"MLXL2XL3XL4XL5XL 常规袖 韩系,欧美 棉 加厚 修身 军绿色,黑色 加长款（大于100cm） 拉链 连帽 长袖 拼接,纯色,抽绳,贴布,数码印花 字母/文字/数字,纯色 冬季",女装,25177,-21.36,384.29,299,11.11红包最高再抵           25.00元,2,64,4.79,4.78,4.78,4.79,22,0,0,1,1,0,1,1,0,0,0,0,0,0,0.778058237,1,1,0,0,0,0,1,0,0,2种优惠,0,0,0,0
