美出新高度欧美牛漆皮圆头粗跟短靴松紧带中跟靴子冬季保暖女鞋,黑色 34 35 36 37 38 39 圆头 切尔西靴 黑色 马丁靴 中跟（3-5CM） 头层牛皮 欧美 橡胶底 超纤 粗跟 漆皮 纯色 短筒 头层牛皮 冬季 套脚,女鞋,132,-5.142857143,893.34,267.1428571,购物满699元立减60元,1,385,4.82,4.8,4.82,4.82,8,0,0,0,0,0,1,1,0,0,0,0,0,0,0.29903828,1,0,1,0,0,0,0,1,0,不超过1种优惠,0.08583691,1,2.667938932,"(2,8]"
靡始2016秋季包臀名媛气质时尚ol职业通勤性感女装连衣裙, SMLXL 常规袖 通勤（OL） 聚酯纤维 修身 蓝色 套头 圆领 长袖 纯色 其他 秋季,女装,793,-0.8,438,218.8,11.11红包最高再抵           25.00元,2,22,4.76,4.76,4.76,4.78,0,0,0,1,0,0,0,0,0,0,0,1,0,0,0.499543379,1,1,0,0,0,0,1,0,0,2种优惠,0,0,0,0
蜜蜂刺绣棒球棉服秋冬新款男士复古刺绣加厚棒球服保暖棉衣,"M L XL 2XL 常规袖 刺绣 基本款,街头 其它材质 宽松 常规款 棒球领 纯色 长袖 黑色 藏青色",男装,799,-6.36,318,222.6,购物满298元立减5元 购物满398元立减10元 购物满598元立减20元,3,16,4.73,4.7,4.72,4.72,2,0,0,1,0,0,0,1,0,0,0,0,0,0,0.7,1,0,1,0,0,0,0,1,0,>2种优惠,0.025116323,0,1.378098409,"(1,2]"
棉服加厚保暖休闲外套棒球服男装夹克修身棉衣韩版青年冬季棉袄子,"M L XL 2XL 常规袖 其它,拼接 日韩,学院 棉,锦棉（有光泽） 直身 常规款 棒球领 其他,纯色 长袖",男装,795,-3.7,370,259,购物满150元立减10元 购物满210元立减15元 购物满280元立减30元,3,15,4.74,4.71,4.73,4.75,7,0,0,0,1,0,0,1,0,0,0,0,1,0,0.7,1,0,1,0,0,0,0,1,0,>2种优惠,0.081746032,1,0.587544066,"(0,1]"
民族风毛衣链子复古吊坠装饰女士长款项链挂饰百搭配饰品衣服挂件,"其它形状/图案 未镶嵌 否 是 学院,文艺,民族风,经典学院风,小清新,中国风 其它样式 51cm-80cm 其它材质 棉麻",女士配饰,1,0,27.23,27.23,NO INF,0,1,4.69,4.66,4.67,4.65,0,0,0,0,0,0,0,0,0,0,0,0,1,0,1,0,0,0,0,0,0,0,0,0,不超过1种优惠,0,0,0,0
明星同款！韩版牛皮星星系带运动鞋女潮百搭学生休闲跑步鞋旅游鞋,"米色 灰色 黑色 黑色加绒款 灰色加绒款 米色加绒款 35 36 37 38 39 圆头 绑带（系带） 灰色加绒款,米色,黑色加绒款,米色加绒款,黑色,灰色 低跟（1-3cm） 韩系 橡胶底 布 平跟（无跟） 拼接 纯色 多种材料拼接 秋冬 系带",女鞋,1448,0,560,173.1,购物满199元立减10元,1,2121,4.78,4.74,4.76,4.76,35,0,0,0,1,0,0,1,0,1,0,0,0,0,0.309107143,1,0,1,0,0,0,0,1,0,不超过1种优惠,0.050251256,1,1.149624495,"(1,2]"
明星同款！韩版真皮厚底运动鞋学生系带休闲鞋跑步鞋女鞋,"黑色 粉红色 灰色 黑色（加棉） 粉色（加棉） 灰色（加棉） 35 36 37 38 39 圆头 韩系,绑带（系带） 灰色,黑色,粉红色 中跟（3-5cm） 韩系,原创设计 橡胶底 布 厚底（松糕） 拼接,磨砂 纯色 多种材料拼接 秋冬 系带",女鞋,2812,-0.83,198.57,138.83,购物满128元立减5元,1,6818,4.77,4.75,4.77,4.77,91,0,0,0,1,0,0,1,0,1,0,0,0,0,0.699148915,1,0,1,0,0,0,0,1,0,不超过1种优惠,0.0390625,0,0.927536232,"(0,1]"
明星同款欧美瘦腿魔法弹力靴厚底长靴休闲女靴子过膝靴,"黑色 35 36 37 38 39 圆头 厚底内增高 黑色 长筒靴（中筒靴） 中跟（3-5CM） 超纤 街头潮人,百搭 橡胶底 人造短毛绒 平跟（无跟） 拼接 纯色 过膝 超纤 秋冬 套脚",女鞋,3491,-7,279,166,购物满119元立减3元,1,2370,4.83,4.82,4.82,4.84,66,0,0,0,0,0,1,1,0,1,0,0,0,0,0.594982079,1,0,1,0,0,0,0,1,0,不超过1种优惠,0.025210084,0,0.748427673,"(0,1]"
明星王子文同款真皮马丁靴女鞋英伦风平底粗跟女靴子学生复古风,"黑色单里 黑色绒里 34 35 36 37 38 39 圆头 铆钉,英伦风 黑色 马丁靴 中跟（3-5cm） 头层牛皮 学院,欧美 橡胶底 人造短毛绒 粗跟 水洗 其他 中筒 头层牛皮 秋冬 拉链,系带",女鞋,1184,0,727,223.05,购物满168元立减2元,1,1425,4.76,4.72,4.72,4.75,8,0,0,0,0,1,1,1,0,1,0,0,1,0,0.306808803,1,0,1,0,0,0,0,1,0,不超过1种优惠,0.011904762,0,0.753194351,"(0,1]"
磨砂真皮秋冬大码短靴低跟尖头平底女靴英伦短筒马丁靴,"黑色 军绿色 杏色 34 35 36 37 38 39 40 41 42 43 尖头 杏色,黑色 马丁靴 中跟（3-5CM） 反毛皮 韩系,通勤（OL） 橡胶底 真皮 细跟 反绒 纯色 短筒 头层牛皮 四季 套脚,松紧带"">更多参数<i></i></a>",女鞋,5997,-7.6,268,187.6,NO INF,0,136,4.83,4.82,4.81,4.82,14,0,0,0,1,1,0,1,0,0,0,1,0,0,0.7,0,0,0,0,0,0,0,0,0,不超过1种优惠,0,0,0,0
墨墨冬季韩版针织波纹提花毛线情侣保暖围巾,"均码 红蓝色 米咖色 黑灰色 百搭,韩系,精致学院风 冬季 围巾/丝巾 毛线 长方形 保暖 拼色/撞色,麻花 30cm-70cm 175cm-230cm 175cm-230cm 毛线",男士饰品,586,-2.571428571,196,58.37142857,购物满78元立减3元 购物满138元立减5元 购物满198元立减10元 购物满298元立减20元,4,57,4.8,4.77,4.79,4.78,5,0,0,0,1,0,0,1,0,0,1,0,1,1,0.297813411,1,0,1,0,0,0,0,1,0,>2种优惠,0.048078142,0,1.397849462,"(1,2]"
男表机械表复古时尚手表男, 均码 白壳黑盘 白壳白盘 间金黑盘 间金白盘 精钢 圆形 日历 精钢,男士饰品,296,0,565,395.5,NO INF,0,1,4.64,4.61,4.61,4.62,0,0,0,0,0,0,0,0,0,0,1,0,0,0,0.7,0,0,0,0,0,0,0,0,0,不超过1种优惠,0,0,0,0
男表精钢全黑夜光机械表,均码 全黑钢带款 精钢钢带款 黑皮全黑款 黑皮精钢款 时尚潮流 蓝宝石水晶玻璃镜面 圆形 精钢 24小时指示 日历 夜光等 蓝宝石水晶玻璃镜面,男士饰品,120,0,1580,790,购物满99元立减3元 购物满199元立减10元 购物满299元立减20元,3,1,4.72,4.68,4.72,4.72,0,0,0,0,0,0,0,0,0,0,1,0,0,0,0.5,1,0,1,0,0,0,0,1,0,>2种优惠,0.049147973,0,0.125316456,"(0,1]"
男款精钢带手表全自动机械表男式休闲男表时尚潮流商务男士腕表,"均码 L-816玫瑰金咖啡面钢带款 L-816玫瑰金黑面钢带款 L-816玫瑰金白面钢带款 L-816银壳黑面钢带款 L-816银壳白面钢带款 潮流时尚 精钢 圆型 其他,精钢,大表盘 日历",男士饰品,1000,0,940,658,购物满99元立减2元 购物满199元立减6元 购物满299元立减10元,3,9,4.59,4.61,4.59,4.62,1,0,0,1,0,0,0,0,0,0,1,0,0,0,0.7,1,0,1,0,0,0,0,1,0,>2种优惠,0.02793253,0,0.150455927,"(0,1]"
男款全自动机械表陀飞轮男士防水镂空时尚腕表男表, 均码 白底银针-棕带 黑底银针-黑带 白底蓝针-棕带 间金白面-棕带 间金黑面-黑带 蓝底银针-黑带 玫瑰金黑-黑带 钢带精钢蓝面 钢带精钢黑面 钢带精钢白面 钢带精钢白面蓝针 钢带间金白面 钢带间金黑面 钢带玫瑰金黑面 商务休闲 精钢 圆型 精钢 陀飞轮 ,男士饰品,2080,0,1596,798,购物满99元立减3元 购物满199元立减10元 购物满299元立减20元,3,12,4.72,4.68,4.72,4.72,0,0,0,0,0,0,0,0,0,0,1,0,0,0,0.5,1,0,1,0,0,0,0,1,0,>2种优惠,0.049147973,0,0.12406015,"(0,1]"
男士春秋季青少年圆领长袖T恤秋衣体恤上衣服打底衫男装潮,"M L XL 2XL 3XL 4XL 5XL 常规袖 其它 基本款,欧美 棉 宽松 圆领 其他 长袖 白色 藏青色 浅灰色 酒红色 黑色",男装,6994,-3.178333333,127.14,88.35833333,购物满129元立减5元 购物满198元立减10元,2,5,4.71,4.69,4.69,4.71,0,0,0,0,0,0,1,0,0,0,0,0,0,0,0.694968801,1,0,1,0,0,0,0,1,0,2种优惠,0.04463237,0,1.514440009,"(1,2]"
男士雕花布洛克英伦风男士皮鞋,"38 39 40 41 42 43 日韩,复古 橡胶发泡 纯色 黑色",男装,1796,-10.6,398,278.6,购物满2元立减2元 购物满139元立减5元 购物满239元立减10元 购物满369元立减15元,4,15,4.54,4.5,4.53,4.54,0,0,0,0,0,1,0,0,0,0,0,0,0,0,0.7,1,0,1,0,0,0,0,1,0,>2种优惠,0.279615658,1,0.007462687,"(0,1]"
男士翻领Polo衫时尚针织打底衫上衣薄款长袖T恤衫条纹爸爸装,"165/48/S 170/50/M 175/52/L 180/54/XL 185/56/XXL 常规袖 水洗,其它,撞色 基本款,商务 针织 宽松 翻领/Polo领 拼色,条纹 长袖 酒红色 蓝色",男装,1993,0,390,78,购物满20元包邮 购物满300元立减20元 购物满150元立减10元 购物满5元立减5元,4,3,4.68,4.67,4.7,4.71,1,0,0,1,0,0,0,0,0,0,0,0,0,0,0.2,1,0,1,0,0,1,0,1,1,>2种优惠,0.377777778,1,0.064102564,"(0,1]"
男士韩版V领网眼长袖T恤打底衫,"M(体重90斤以下) L(体重110斤以下) XL(体重125斤以下) 2XL(体重140斤以下) 3XL(体重150斤以下) 4XL(体重160斤以下) 5XL(体重180斤以下) 6XL(体重200斤以下) 常规袖 其它 日韩,基本款 棉 修身 常规款 V领 纯色 长袖",男装,3985,-4.285714286,140,97.28571429,购物满55元立减2元 购物满99元立减5元 购物满198元立减10元,3,19,4.68,4.66,4.68,4.68,4,0,0,1,1,0,0,0,0,0,0,0,0,0,0.694897959,1,0,1,0,0,0,0,1,0,>2种优惠,0.045791246,0,0.591397849,"(0,1]"
男士韩版修身棉衣时尚休闲皮衣棉衣潮,"M L XL 2XL 3XL 常规袖 其它 街头潮人,男友风 PU 收腰 常规款 棒球领 纯色 长袖",男装,1990,0,259,253.82,购物满159元立减5元 购物满259元立减10元 购物满289元立减12元 购物满2件打9.80折 购物满198元立减10元,5,3,4.62,4.56,4.61,4.65,1,0,0,0,1,0,0,0,0,0,0,0,0,0,0.98,1,0,1,1,0,0,0,1,1,>2种优惠,0.04052103,0,0.626428177,"(0,1]"
男士韩版修身羽绒服男中长款加厚连帽青年外套,"M L XL 2XL 3XL 其它 学院,欧美 其它材质 修身 常规款 连帽 纯色",男装,2385,0,599,587.02,购物满159元立减5元 购物满259元立减10元 购物满289元立减12元 购物满2件打9.80折 购物满198元立减10元,5,1,4.62,4.57,4.61,4.66,0,0,0,0,1,0,1,0,0,0,0,0,1,0,0.98,1,0,1,1,0,0,0,1,1,>2种优惠,0.04052103,0,0.270859596,"(0,1]"
男士加绒长袖T恤冬季新品韩版大码男士加厚打底衫保暖卫衣男装,"M L XL XXL 3XL 常规袖 其它 日韩,学院 棉 修身 常规款 圆领 纯色 长袖",男装,9984,-1.628571429,80,56.72857143,购物满99元立减10元 购物满199元立减20元 购物满299元立减30元 购物满79元立减5元,4,10,4.75,4.71,4.73,4.74,6,0,0,0,1,0,0,1,0,0,0,0,1,0,0.709107143,1,0,1,0,0,0,0,1,0,>2种优惠,0.09128455,1,1.433756806,"(1,2]"
男士男表皮带腕表防水学生时尚潮流多功能石英表手表女表, 均码 男夜光双历钢色黑面 男夜光双历间金白面 男夜光双历钢色白面 男夜光双历间金金面 男夜光双历间金黑面 女夜光单历钢色黑面 女夜光单历钢色白面 女夜光单历金色黑面 女夜光单历金色白 女夜光单历金色金面 男日月间金白面 男日月间金黑面 男日月间金棕面 男日月钢色白面 男日月钢色黑面 男六针间金白面 男六针间金黑面 男六针间金棕面 男六针钢色白面 男六针钢色黑面 商务休闲 皮革 圆型 其他 世界时间 ,男士饰品,3999,0,340,238,购物满99元立减2元 购物满199元立减6元 购物满299元立减10元,3,4,4.59,4.61,4.59,4.62,0,0,0,0,0,0,0,0,0,0,1,0,0,0,0.7,1,0,1,0,0,0,0,1,0,>2种优惠,0.02793253,0,0.415966387,"(0,1]"
男士皮带超薄防水石英表男款时尚三眼六针手表休闲夜光男表, 均码 白面蓝针 白面玫瑰金 黑面本色 黑面玫瑰金 咖啡面本色 户外运动 皮革 世界时间 ,男士饰品,233,0,656,328,购物满100元立减3元 购物满200元立减10元 购物满300元立减20元,3,30,4.73,4.67,4.68,4.7,0,0,0,0,0,0,0,0,0,0,1,0,0,0,0.5,1,0,1,0,0,0,0,1,0,>2种优惠,0.048888889,0,0.304878049,"(0,1]"
男士皮带全自动商务机械表男款休闲手表时尚男式男表日历星期, 均码 白面间金 白面本色 黑面本色 黑面间金 户外运动 皮革 其他 ,男士饰品,190,0,1596,798,购物满100元立减3元 购物满200元立减10元 购物满300元立减20元,3,12,4.73,4.67,4.68,4.7,0,0,0,0,0,0,0,0,0,0,1,0,0,0,0.5,1,0,1,0,0,0,0,1,0,>2种优惠,0.048888889,0,0.125313283,"(0,1]"
男士秋冬季中长款连帽羽绒服韩版修身羽绒棉衣外套加厚潮大衣,"M L XL 2XL 3XL 常规袖 口袋 基本款,欧美 棉 宽松 中长款 连帽 纯色 长袖",男装,26708,-30.303,340,302.998,购物满129元立减5元 购物满198元立减10元,2,80,4.7,4.68,4.68,4.71,30,0,0,0,1,0,1,1,0,0,0,0,0,0,0.891170588,1,0,1,0,0,0,0,1,0,2种优惠,0.04463237,0,0.473055978,"(0,1]"
男士秋冬新款V领长袖加绒T恤韩版修身大码套头打底衫,"黑色 蓝色 灰色 酒红 咖啡 M(体重90斤以下) L(体重110斤以下) XL(体重125斤以下) 2XL(体重140斤以下) 3XL(体重150斤以下) 4XL(体重160斤以下) 5XL(体重180斤以下) 6XL(体重200斤以下) 常规袖 其它 日韩,学院 棉 修身 常规款 V领 纯色 长袖",男装,3913,-6.857142857,140,96.85714286,购物满55元立减2元 购物满98元立减5元 购物满198元立减10元,3,243,4.76,4.75,4.75,4.78,25,0,0,1,1,0,0,1,0,0,0,0,1,0,0.691836735,1,0,1,0,0,0,0,1,0,>2种优惠,0.045963032,0,0.611111111,"(0,1]"
男士秋冬新款拼接三条杠长袖t恤套头卫衣T恤男装上衣打底衫,"M L XL 2XL 3XL 常规袖 拼接 日韩,学院 化纤 修身 常规款 圆领 色块 长袖",男装,1489,-5.2,126,88.2,购物满55元立减2元 购物满99元立减5元 购物满198元立减10元,3,14,4.68,4.66,4.68,4.68,5,0,0,1,0,0,0,1,0,0,0,0,1,0,0.7,1,0,1,0,0,0,0,1,0,>2种优惠,0.045791246,0,0.662650602,"(0,1]"
男士商务休闲手表时尚腕表,均码 白色 黑色 玻璃 圆形 24小时指示 玻璃,男士饰品,388,0,394,118.2,NO INF,0,28,4.64,4.62,4.63,4.66,0,0,0,0,0,0,0,0,0,0,1,0,0,0,0.3,0,0,0,0,0,0,0,0,0,不超过1种优惠,0,0,0,0
男士时尚简约Z字皮带休闲百搭,"均码 白色 黑色 学院,街头 不锈钢头 其它 单圈 普通款(2-4cm) 平滑扣 光面 其它 其他材质",男士饰品,399,0,230,69,购物满2元立减2元 购物满128元立减5元 购物满188元立减8元 购物满268元立减15元,4,11,4.67,4.66,4.64,4.65,2,0,0,0,0,0,0,0,0,0,1,0,1,0,0.3,1,0,1,0,0,0,0,1,0,>2种优惠,0.28439646,1,0.028985507,"(0,1]"
男士手表男夜光自动机械男表时尚钢带防水小三针带日历多功能腕表," 均码 钢带白面 钢带蓝面 钢带黑面 钢带全黑 钢带全金 商务休闲 精钢 圆型 钢带白面,钢带全黑,钢带蓝面,钢带黑面,钢带全金 日历 ",男士饰品,500,0,754.29,528,购物满80元立减4元 购物满120元立减5元 购物满200元立减10元 购物满300元立减12元 购物满400元立减20元 购物满500元立减30元 购物满800元立减50元 购物满1000元立减80元,8,0,4.46,4.4,4.4,4.43,0,0,0,0,0,0,0,0,0,0,1,0,0,0,0.699996023,1,0,1,0,0,0,0,1,0,>2种优惠,0.054270833,1,0.151515152,"(0,1]"
男士夏季小清新短袖t恤, 橘色 黑色 黄色 蓝色 红色 绿色 【尺寸偏大】 S M L XL 常规 棉 修身 常规款 圆领 短袖 ,男装,27990,0,298,208.6,购物满2件立减10元 购物满599元立减50元,2,8,4.66,4.69,4.68,4.72,0,0,0,0,0,0,0,0,0,0,0,0,0,0,0.7,1,0,1,0,0,0,0,1,0,2种优惠,0.083472454,1,2.871524449,"(2,8]"
男士休闲商务diy皮带自动扣刻字真皮腰带,"105 110 115 120 125 黑银 商务,学院 合金头 光身,磨砂 单圈 3-4cm 自动扣 磨砂 光身,磨砂 牛皮",男士饰品,102,-9.1,83,58.1,NO INF,0,5,4.64,4.58,4.58,4.66,3,0,0,0,0,0,0,0,0,0,0,0,1,0,0.7,0,0,0,0,0,0,0,0,0,不超过1种优惠,0,0,0,0
男士休闲时尚男表皮带防水商务腕表石英表手表,均码 05款-玫瑰金棕面棕带 04款-玫瑰金白面棕带 03款-玫瑰金黑面黑带 02款-白面棕带 01款-黑面黑带 商务休闲 皮革 圆型 其他 世界时间,男士饰品,989,0,340,238,购物满99元立减2元 购物满199元立减6元 购物满299元立减10元,3,26,4.59,4.61,4.59,4.62,0,0,0,0,0,0,0,0,0,0,1,0,0,0,0.7,1,0,1,0,0,0,0,1,0,>2种优惠,0.02793253,0,0.415966387,"(0,1]"
男士休闲时尚商务男表夜光运动多功能石英表防水皮带手表, 均码 主：银壳蓝面 主：银壳白面蓝针 主：银壳黑面 主：玫瑰金壳咖啡面 主：玫瑰金壳白面金针 主：玫瑰金壳黑面 主：玫瑰金壳白面蓝针 主：银壳白面银针 商务休闲 皮革 圆型 其他 世界时间 ,男士饰品,1596,0,340,238,购物满99元立减2元 购物满199元立减6元 购物满299元立减10元,3,9,4.59,4.61,4.59,4.62,0,0,0,0,0,0,0,0,0,0,1,0,0,0,0.7,1,0,1,0,0,0,0,1,0,>2种优惠,0.02793253,0,0.415966387,"(0,1]"
男士休闲时尚双日历商务石英表防水手表, 均码 黑盘银色钢带 送皮带+电子+调表器 商务休闲 钢 圆型 其他 世界时间 ,男士饰品,396,0,383,268.1,购物满99元立减2元 购物满199元立减6元 购物满299元立减10元,3,9,4.59,4.61,4.59,4.62,1,0,0,0,0,0,0,0,0,0,1,0,0,0,0.7,1,0,1,0,0,0,0,1,0,>2种优惠,0.02793253,0,0.3692652,"(0,1]"
男士腰带平滑扣青年商务休闲时尚裤腰带,"均码 浅棕色 黑色 商务,街头 合金头 光身,其它 单圈 普通款(2-4cm) 平滑扣 光面 光身,其它 牛皮",男士饰品,399,-3,430,129,购物满2元立减2元 购物满128元立减5元 购物满188元立减8元 购物满268元立减15元,4,4,4.67,4.66,4.64,4.65,1,0,0,0,0,0,0,0,0,0,1,0,0,0,0.3,1,0,1,0,0,0,0,1,0,>2种优惠,0.28439646,1,0.015873016,"(0,1]"
男士长袖T恤圆领青少年青春t血长袖体恤潮上衣服打底衫,"M L XL 2XL 3XL 4XL 5XL 常规袖 其它 日韩,学院 棉 直身 圆领 其他 长袖 白色 黑色 藏青色",男装,6295,-19.69,179,78.76,购物满99元立减5元 购物满199元立减10元 购物满299元立减15元 购物满499元立减30元,4,6,4.83,4.81,4.82,4.83,0,0,0,0,0,0,0,0,0,0,0,0,1,0,0.44,1,0,1,0,0,0,0,1,0,>2种优惠,0.052760943,1,1.675977654,"(1,2]"
男士中长款连帽羽绒服青年大毛领修身韩版加厚外套,"M L XL 2XL 3XL 其他袖型 贴袋 日韩,街头 复合 修身 中长款 可脱卸帽 纯色",男装,19996,0,468,327.6,购物满99元立减2元 购物满165元立减5元 购物满325元立减10元,3,44,4.66,4.66,4.64,4.65,5,0,0,0,1,0,0,0,0,0,0,0,0,0,0.7,1,0,1,0,0,0,0,1,0,>2种优惠,0.027091427,0,0.302197802,"(0,1]"
男友礼物专柜正品高档皮带男自动扣时尚真皮头层牛皮腰带礼盒,"均码 咖红 基本款,欧美 合金头 光身,车缝线 单圈 3-4cm 自动扣 软面 光身,车缝线 牛皮",男士饰品,496,-0.9,356,248.9,NO INF,0,5,4.73,4.69,4.7,4.77,3,0,0,0,0,0,1,0,1,0,1,0,0,0,0.699157303,0,0,0,0,0,0,0,0,0,不超过1种优惠,0,0,0,0
男友生日礼物多款可选百搭针扣商务男士皮带精美礼盒,"均码 款式一0507 款式二0208 款式三0506 款式四0377 款式五0937 款式六0505 款式七0109 款式八0199 款式九0101 款式十0102 基本款,街头 合金头 格纹,车缝线,拼带 单圈 3-4cm 针扣 软面 格纹,车缝线,拼带 牛皮",男士饰品,3994,-1.3,169,118.3,NO INF,0,6,4.73,4.69,4.7,4.77,1,0,0,0,0,0,0,0,1,0,1,0,0,0,0.7,0,0,0,0,0,0,0,0,0,不超过1种优惠,0,0,0,0
男装卫衣男圆领韩版潮流韩版学生纯色运动上衣男士秋季长袖T恤衫,"M L XL 2XL 常规袖 其它,水洗 基本款 棉 宽松 常规款 圆领 其他,纯色 长袖 藏青色 黑色 白色 浅灰色 杏色",男装,3986,-2.7,111,77.7,购物满300元立减15元 购物满3件打9.50折 购物满100元立减5元 购物满150元立减7元 购物满200元立减10元,5,60,4.67,4.61,4.64,4.68,2,0,0,0,1,0,0,0,0,0,0,0,0,0,0.7,1,0,1,1,0,0,0,1,1,>2种优惠,0.049166667,0,1.333333333,"(1,2]"
牛皮反绒雪地靴新款短筒短靴一脚蹬懒人鞋女鞋真皮保暖皮靴靴子,"黑色 灰色 粉红色 驼色 米色 35 36 37 38 39 正规码！ 英伦风,布洛克 米色,粉红色,驼色,黑色,灰色 低跟（1-3cm） 甜美,韩系 橡胶底 人造长毛绒 反绒,磨砂 纯色 皮毛一体 秋冬 套脚,松紧带",女鞋,3110,-17.6,258,197.6,购物满60元立减20元,1,6960,4.82,4.81,4.8,4.81,85,0,0,1,1,1,0,1,0,0,0,0,0,0,0.765891473,1,0,1,0,0,0,0,1,0,不超过1种优惠,0.333333333,1,0.333333333,"(0,1]"
牛皮露趾露跟松糕鞋凉鞋子,34 35 36 37 38 39 高跟 聚氨酯 魔术贴,女鞋,0,0,788,551.6,购物满10元立减10元,1,1,4.71,4.68,4.68,4.72,0,0,0,0,0,0,0,0,0,0,0,0,0,0,0.7,1,0,1,0,0,0,0,1,0,不超过1种优惠,1,1,0.018129079,"(0,1]"
女款手表水钻防水石英表, ,女士配饰,99,0,528,528,NO INF,0,99,4.7,4.69,4.68,4.71,0,0,0,0,0,0,0,0,0,0,0,0,0,0,1,0,0,0,0,0,0,0,0,0,不超过1种优惠,0,0,0,0
女神高圆圆同款简约尖头鞋粗跟鞋高跟鞋短靴及踝靴骑士靴,"黑色加毛 红色加毛 黄色加毛 34 35 36 37 38 39 尖头 机车靴,英伦风 黄色,黑色,红色 短靴 超高跟（大于8CM） 人造革（PU） 韩系,森系 橡胶底 人造短毛绒 粗跟 无工艺效果 纯色 短筒 人造革（PU） 秋冬 拉链",女鞋,6988,-13.58333333,179,122.5833333,购物满109元立减5元,1,5579,4.83,4.82,4.82,4.82,142,0,0,0,1,1,0,1,0,1,0,0,0,0,0.684823091,1,0,1,0,0,0,0,1,0,不超过1种优惠,0.04587156,0,1,"(1,2]"
女装针织衫_长款套头毛衣裙冬季中长款女装针织衫打底衫宽松秋冬,均码 常规袖 通勤（OL） 针织 普通 宽松 黑色 中长款（66-80cm） 无扣 V领 长袖 纯色 其它形状 秋季,女装,670,-4,330,99,11.11红包最高再抵           10.00元,2,747,4.78,4.77,4.79,4.77,27,0,0,0,0,0,0,1,0,0,1,1,0,0,0.3,1,1,0,0,0,0,1,0,0,2种优惠,0,0,0,0
欧美潮流内增高马丁靴真皮新款靴子厚底短靴秋冬百搭裸靴机车靴,"黑色单里 红色单里 花色单里 黑色加绒 红色加绒 34 35 36 37 38 39 40 标准尺码 圆头 机车靴,英伦风,切尔西靴 红色单里,黑色加绒,红色加绒,黑色单里,花色单里 马丁靴 高跟（5-8CM） 头层牛皮 百搭,韩系 牛筋底 超纤 厚底内增高 拼接,无工艺效果 花色,纯色 短筒 头层牛皮 秋冬 系带,绑带",女鞋,7942,-6.466666667,211,144.4666667,NO INF,0,2087,4.8,4.79,4.79,4.79,125,0,0,1,1,1,1,1,0,0,0,0,0,0,0.684676145,0,0,0,0,0,0,0,0,0,不超过1种优惠,0,0,0,0
欧美风秋冬新品夹克女装棉服外套加棉加厚棒球服,"SML 常规袖 韩系,欧美 天鹅绒 加厚 宽松 蓝色 常规款（51-65cm） 拉链 立领 长袖 撞色,金属装饰,刺绣,肩章,罗纹,口袋 字母/文字/数字,抽象图案 秋冬",女装,595,-10.66666667,372.5,296.6666667,11.11红包最高再抵           30.00元,2,51,4.81,4.77,4.81,4.8,1,0,0,0,1,0,1,1,0,0,0,0,0,0,0.796420582,1,1,0,0,0,0,1,0,0,2种优惠,0,0,0,0
欧美韩国奢华高档复古气质水钻水晶耳钉耳饰女士气质耳环饰品配饰," 玫瑰/四叶草/花草 未镶嵌 复古风,甜美,文艺小清新,专属运动风,时尚中性,时尚运动风 ",女士配饰,72,-5.208333333,23.20833333,23.20833333,11.11红包最高再抵           2.00元,2,72,4.7,4.66,4.67,4.68,16,0,0,0,1,0,1,0,0,0,0,0,0,0,1,1,1,0,0,0,0,1,0,0,2种优惠,0,0,0,0
欧美尖头后拉链高跟过膝靴秋冬季新款显瘦羊皮长靴时尚粗跟女靴子,"黑色单里 黑色绒里 灰色单里 灰色绒里 驼色单里 驼色绒里 黑色绒面单里 黑色绒里绒里 34 35 36 37 38 39 尖头 拉链 灰色,驼色,黑色 长筒靴（中筒靴） 高跟（5-8cm） 羊皮 简约,欧美 橡胶底 人造短毛绒 粗跟 绒面 纯色 过膝 羊皮 秋季 拉链",女鞋,4788,-7.5,341.43,236.5,购物满139元立减3元,1,99,4.8,4.76,4.78,4.75,7,0,0,1,0,0,1,1,0,0,0,0,0,0,0.692674926,1,0,1,0,0,0,0,1,0,不超过1种优惠,0.021582734,0,0.6069869,"(0,1]"
欧美新款牛皮粗跟过膝弹力长靴牛皮高筒靴粗跟过膝靴牛皮女靴子,"""黑色牛皮单里 ""黑色牛皮绒里 ""黑色羊皮单里 ""黑色羊皮绒里 34 35 36 37 38 39 尖头 拉链 黑色 长筒靴（中筒靴） 中跟（3-5cm） 头层牛皮 轻熟,欧美 橡胶底 超纤 粗跟 拼接 纯色 过膝 头层牛皮 冬季 拉链",女鞋,2562,-0.171428571,356,249.1714286,购物满150元立减5元,1,575,4.73,4.71,4.7,4.72,18,0,0,1,0,0,1,1,0,0,0,0,0,0,0.699919743,1,0,1,0,0,0,0,1,0,不超过1种优惠,0.033333333,0,0.602409638,"(0,1]"
欧美新款羊皮长靴拉链高筒靴羊皮长筒靴高跟长靴羊皮女靴子,"""黑色【绒里】 ""白色【绒里】 34 35 36 37 38 39 圆头 拉链 黑色,白色 长筒靴（中筒靴） 中跟（3-5cm） 羊皮 街头潮人,欧美 橡胶底 人造长毛绒 粗跟 拼接 纯色 长筒 羊皮 冬季 拉链",女鞋,1199,-0.3,499,349.3,购物满150元立减5元,1,11,4.73,4.71,4.7,4.72,1,0,0,1,0,0,1,1,0,0,0,0,0,0,0.7,1,0,1,0,0,0,0,1,0,不超过1种优惠,0.033333333,0,0.429799427,"(0,1]"
欧洲站2016新款外套短款女装韩版气质名媛修身狐狸毛皮草,"SMLXLXXL 轻熟,通勤（OL） 其他 直身 蓝色,绿色,红色 短款（41-50cm） 圆领 七分袖 冬季",女装,2626,0,670,469,11.11红包最高再抵           50.00元,2,28,4.81,4.81,4.82,4.83,15,0,0,1,1,0,0,1,0,0,0,1,0,0,0.7,1,1,0,0,0,0,1,0,0,2种优惠,0,0,0,0
欧洲站冬装新款时尚女装欧货潮修身毛毛口袋中长款收腰显瘦棉服女,SML 常规袖 街头（潮人） 羊毛 普通 X型（收腰） 粉红色 中长款（66-80cm） 一粒单排扣 荷叶领 长袖 磨破 纯色 冬季,女装,600,0,900,630,NO INF,0,3,4.58,4.51,4.55,4.54,0,0,0,1,0,0,0,1,0,0,0,0,0,0,0.7,0,0,0,0,0,0,0,0,0,不超过1种优惠,0,0,0,0
欧洲站复古舒适显瘦高跟单鞋尖头系带休闲粗跟小白鞋子,"黑色 白色 酒红色 棕色 33 34 35 36 37 38 39 40 31 32 米白,黑色,酒红色 高跟单鞋 高跟（5-8CM） 基本款,欧美 橡胶底 超纤 拼接 其他,纯色 超纤 四季 套脚,系带,松紧带",女鞋,2742,-1.4,398,119.4,购物满10元立减10元,1,1599,4.8,4.76,4.77,4.78,7,0,0,0,0,0,1,0,0,0,0,0,0,0,0.3,1,0,1,0,0,0,0,1,0,不超过1种优惠,1,1,0.084745763,"(0,1]"
欧洲站木头纹坡跟鞋单鞋子,34 35 36 37 38 39 超高跟 EVA发泡 前系带,女鞋,792,0,916,641.2,购物满10元立减10元,1,37,4.7,4.68,4.67,4.7,0,0,0,0,0,0,0,0,0,0,0,0,0,0,0.7,1,0,1,0,0,0,0,1,0,不超过1种优惠,1,1,0.015595758,"(0,1]"
欧洲站系带简约内增高单鞋,34 35 36 37 38 39 高跟 橡胶 系带,女鞋,1056,0,788,551.6,购物满10元立减10元,1,2,4.71,4.69,4.67,4.7,0,0,0,0,0,0,0,0,0,0,0,0,0,0,0.7,1,0,1,0,0,0,0,1,0,不超过1种优惠,1,1,0.018129079,"(0,1]"
